name_en,name_ar,id,category
Sidi Kerir Petrochemicals - SIDPEC,سيدى كرير للبتروكيماويات - سيدبك,EGS380S1C017,Basic Resources
Sinai Cement,اسمنت سيناء,EGS3C401C014,Building Materials
Six of October Development & Investment (SODIC),السادس من اكتوبر للتنميه والاستثمار- سوديك,EGS65851C015,Real Estate
Societe Arabe Internationale De Banque S.A.E.,بنك الشركة المصرفية العربية الدولية- شركة مساهمة مصرية,EGS60142C014,Banks
South Cairo & Giza Mills & Bakeries,مطاحن ومخابز جنوب القاهرة والجيزة,EGS30411C010,"Food, Beverages and Tobacco"
South Valley Cement,جنوب الوادى للاسمنت,EGS3C351C011,Building Materials
Speed Medical,سبيد ميديكال,EGS73BR1C013,Health Care & Pharmaceuticals
Sues Canal Company For Technology Settling,قناة السويس لتوطين التكنولوجيا,EGS740C1C010,Education Services
Suez Canal Bank S.A.E,بنك قناة السويس شركة مساهمة مصرية,EGS60231C015,Banks
T M G Holding,مجموعة طلعت مصطفى القابضة,EGS691S1C011,Real Estate
Taaleem Management Services,Taaleem Management Services تعليم لخدمات الإدارة,EGS597R1C017,Education Services
Tanmiya for Real Estate Investment,تنمية للاستثمار العقاري,EGS21EB1C011,Real Estate
Taqa Arabia,طاقة عربية,EGS490S1C014,Utilities
Telecom Egypt,المصرية للاتصالات,EGS48031C016,"IT , Media & Communication Services"
Tenth Of Ramadan Pharmaceutical Industries&Diagnostic-Rameda,العاشر من رمضان للصناعات الدوائية والمستحضرات تشخيصية-راميدا,EGS381B1C015,Health Care & Pharmaceuticals
The Arab Ceramic CO.- Ceramica Remas,العربية للخزف - سيراميكا ريماس,EGS3C151C015,Building Materials
The Arab Dairy Products Co. Arab Dairy - Panda,"العربية لمنتجات الألبان"" آراب ديرى - باندا""",EGS30221C013,"Food, Beverages and Tobacco"
The Egyptian Company for Construction Development-Lift Slab,المصرية لتطوير صناعة البناء (ليفت سلاب مصر ),EGS23141C012,Contracting & Construction Engineering
The Egyptian Modern Education Systems,المصرية لنظم التعليم الحديثة,EGS729F1C012,Education Services
The United Bank,المصرف المتحد,EGS600M1C017,Banks
TransOceans Tours,عبر المحيطات للسياحه,EGS79072C012,Travel & Leisure
United Housing & Development,المتحدة للاسكان والتعمير,EGS65061C011,Real Estate
Universal For Paper and Packaging Materials (Unipack,يونيفرسال لصناعة مواد التعبئة و التغليف و الورق - يونيباك,EGS38161C013,Paper & Packaging
Upper Egypt Flour Mills,مطاحن مصر العليا,EGS30451C016,"Food, Beverages and Tobacco"
Wadi Kom Ombo Land Reclamation,وادي كوم امبو لاستصلاح الاراضي,EGS01071C017,Contracting & Construction Engineering
Zahraa Maadi Investment & Development,زهراء المعادي للاستثمار والتعمير,EGS21171C011,Real Estate
